{
  "schema_version": "helm-pattern-database-v1",
  "total_patterns": 28,
  "total_charts": 3,
  "patterns_by_chart": [
    {
      "name": "cert-manager",
      "count": 8
    },
    {
      "name": "kube-prometheus-stack",
      "count": 10
    },
    {
      "name": "traefik",
      "count": 10
    }
  ],
  "patterns_by_phase": [
    {
      "name": "post_render",
      "count": 11
    },
    {
      "name": "pre_render",
      "count": 17
    }
  ],
  "patterns_by_severity": [
    {
      "name": "critical",
      "count": 3
    },
    {
      "name": "info",
      "count": 3
    },
    {
      "name": "warning",
      "count": 22
    }
  ],
  "patterns_by_category": [
    {
      "name": "compliance",
      "count": 2
    },
    {
      "name": "cost",
      "count": 1
    },
    {
      "name": "operability",
      "count": 3
    },
    {
      "name": "reliability",
      "count": 15
    },
    {
      "name": "security",
      "count": 6
    },
    {
      "name": "upgrade",
      "count": 1
    }
  ],
  "entries": [
    {
      "id": "HELM-CERTMANAGER-0001",
      "chart": "cert-manager",
      "repository": "https://github.com/cert-manager/cert-manager/tree/master/deploy/charts/cert-manager",
      "phase": "pre_render",
      "category": "reliability",
      "severity": "warning",
      "title": "cert-manager controller replica count stays single",
      "chart_version_selectors": [],
      "predicate": {
        "type": "values_assertion",
        "expression": "values.replicaCount is missing or less than 2"
      },
      "impact": "Certificate issuance and renewal lose HA during node disruption.",
      "remediation": {
        "summary": "Run at least two controller replicas for production clusters.",
        "actions": [
          "Set replicaCount=2 or greater in production values.",
          "Validate leader election and failover behavior in staging."
        ]
      },
      "evidence": [
        "https://cert-manager.io/docs/installation/helm/"
      ],
      "tags": [
        "availability",
        "controller"
      ],
      "source_file": "risks/helm-patterns/cert-manager.yaml"
    },
    {
      "id": "HELM-CERTMANAGER-0002",
      "chart": "cert-manager",
      "repository": "https://github.com/cert-manager/cert-manager/tree/master/deploy/charts/cert-manager",
      "phase": "pre_render",
      "category": "reliability",
      "severity": "warning",
      "title": "cert-manager webhook replica count stays single",
      "chart_version_selectors": [],
      "predicate": {
        "type": "values_assertion",
        "expression": "values.webhook.replicaCount is missing or less than 2"
      },
      "impact": "Admission reliability degrades when webhook pod restarts or nodes drain.",
      "remediation": {
        "summary": "Run at least two webhook replicas for resilient admission flow.",
        "actions": [
          "Set webhook.replicaCount=2 or greater.",
          "Verify anti-affinity and disruption budgets for webhook pods."
        ]
      },
      "evidence": [
        "https://cert-manager.io/docs/installation/best-practice/"
      ],
      "tags": [
        "webhook",
        "availability"
      ],
      "source_file": "risks/helm-patterns/cert-manager.yaml"
    },
    {
      "id": "HELM-CERTMANAGER-0003",
      "chart": "cert-manager",
      "repository": "https://github.com/cert-manager/cert-manager/tree/master/deploy/charts/cert-manager",
      "phase": "post_render",
      "category": "reliability",
      "severity": "critical",
      "title": "Rendered cert-manager controller deployment is single replica",
      "chart_version_selectors": [],
      "predicate": {
        "type": "rendered_manifest_assertion",
        "expression": "Deployment cert-manager has spec.replicas < 2"
      },
      "impact": "Controller downtime can block renewals and certificate issuance workflows.",
      "remediation": {
        "summary": "Render cert-manager deployment with at least two replicas.",
        "actions": [
          "Increase deployment replicas for cert-manager controller.",
          "Confirm leader election and queue processing continuity."
        ]
      },
      "evidence": [
        "https://cert-manager.io/docs/installation/best-practice/"
      ],
      "tags": [
        "rendered",
        "availability"
      ],
      "source_file": "risks/helm-patterns/cert-manager.yaml"
    },
    {
      "id": "HELM-CERTMANAGER-0004",
      "chart": "cert-manager",
      "repository": "https://github.com/cert-manager/cert-manager/tree/master/deploy/charts/cert-manager",
      "phase": "post_render",
      "category": "reliability",
      "severity": "warning",
      "title": "Rendered cert-manager webhook container lacks resource requests/limits",
      "chart_version_selectors": [],
      "predicate": {
        "type": "rendered_manifest_assertion",
        "expression": "Deployment cert-manager-webhook container resources.requests or resources.limits missing"
      },
      "impact": "Admission path can become unstable under load or node pressure.",
      "remediation": {
        "summary": "Define CPU and memory requests/limits for webhook containers.",
        "actions": [
          "Configure requests and limits for cert-manager-webhook.",
          "Tune resource envelopes with admission latency SLO targets."
        ]
      },
      "evidence": [
        "https://kubernetes.io/docs/concepts/configuration/manage-resources-containers/",
        "https://cert-manager.io/docs/"
      ],
      "tags": [
        "resources",
        "webhook"
      ],
      "source_file": "risks/helm-patterns/cert-manager.yaml"
    },
    {
      "id": "HELM-CERTMANAGER-0005",
      "chart": "cert-manager",
      "repository": "https://github.com/cert-manager/cert-manager/tree/master/deploy/charts/cert-manager",
      "phase": "pre_render",
      "category": "reliability",
      "severity": "warning",
      "title": "cert-manager cainjector replica count stays single",
      "chart_version_selectors": [],
      "predicate": {
        "type": "values_assertion",
        "expression": "values.cainjector.replicaCount is missing or less than 2"
      },
      "impact": "CA bundle injection can become unavailable during node disruption.",
      "remediation": {
        "summary": "Run at least two cainjector replicas for resilient certificate updates.",
        "actions": [
          "Set cainjector.replicaCount=2 or greater.",
          "Validate failover while certificate resources continue reconciling."
        ]
      },
      "evidence": [
        "https://cert-manager.io/docs/installation/best-practice/"
      ],
      "tags": [
        "cainjector",
        "availability"
      ],
      "source_file": "risks/helm-patterns/cert-manager.yaml"
    },
    {
      "id": "HELM-CERTMANAGER-0006",
      "chart": "cert-manager",
      "repository": "https://github.com/cert-manager/cert-manager/tree/master/deploy/charts/cert-manager",
      "phase": "post_render",
      "category": "reliability",
      "severity": "warning",
      "title": "Rendered cert-manager webhook deployment is single replica",
      "chart_version_selectors": [],
      "predicate": {
        "type": "rendered_manifest_assertion",
        "expression": "Deployment cert-manager-webhook has spec.replicas < 2"
      },
      "impact": "Admission path resilience degrades during node drain or restart events.",
      "remediation": {
        "summary": "Render cert-manager webhook deployment with at least two replicas.",
        "actions": [
          "Increase webhook replicas in chart values and re-render manifests.",
          "Verify pod disruption behavior during maintenance windows."
        ]
      },
      "evidence": [
        "https://cert-manager.io/docs/installation/best-practice/",
        "https://kubernetes.io/docs/tasks/run-application/configure-pdb/"
      ],
      "tags": [
        "rendered",
        "webhook"
      ],
      "source_file": "risks/helm-patterns/cert-manager.yaml"
    },
    {
      "id": "HELM-CERTMANAGER-0007",
      "chart": "cert-manager",
      "repository": "https://github.com/cert-manager/cert-manager/tree/master/deploy/charts/cert-manager",
      "phase": "post_render",
      "category": "reliability",
      "severity": "warning",
      "title": "Rendered cert-manager cainjector deployment is single replica",
      "chart_version_selectors": [],
      "predicate": {
        "type": "rendered_manifest_assertion",
        "expression": "Deployment cert-manager-cainjector has spec.replicas < 2"
      },
      "impact": "CA bundle propagation resilience degrades during pod restarts or node drains.",
      "remediation": {
        "summary": "Render cert-manager cainjector with at least two replicas.",
        "actions": [
          "Increase cainjector replicas in chart values and re-render manifests.",
          "Verify CA injection continuity during maintenance windows."
        ]
      },
      "evidence": [
        "https://cert-manager.io/docs/installation/best-practice/",
        "https://kubernetes.io/docs/tasks/run-application/configure-pdb/"
      ],
      "tags": [
        "rendered",
        "cainjector"
      ],
      "source_file": "risks/helm-patterns/cert-manager.yaml"
    },
    {
      "id": "HELM-CERTMANAGER-0008",
      "chart": "cert-manager",
      "repository": "https://github.com/cert-manager/cert-manager/tree/master/deploy/charts/cert-manager",
      "phase": "post_render",
      "category": "reliability",
      "severity": "warning",
      "title": "Rendered cert-manager cainjector container lacks resource requests/limits",
      "chart_version_selectors": [],
      "predicate": {
        "type": "rendered_manifest_assertion",
        "expression": "Deployment cert-manager-cainjector container resources.requests or resources.limits missing"
      },
      "impact": "CA injection throughput can degrade under load or node pressure.",
      "remediation": {